,filename,date,player,rumors
0,4GuMWHaJh_g.json,2024/10/05,Rudiger,Free transfer
1,4GuMWHaJh_g.json,2024/10/05,Juan Martinez,Transfer to Real Madrid
2,4GuMWHaJh_g.json,2024/10/05,Inter Milan,"Inter Milan has been mentioned as a potential destination for Paul Pogba, who is set to leave Juventus. However, it's not clear if the club is actively pursuing the player at this time."
3,4GuMWHaJh_g.json,2024/10/05,Paul Pogba,Set to return to professional football
4,4GuMWHaJh_g.json,2024/10/05,Ferland Mendy Mende,"Real Madrid has set to extend the contract of Ferland Mendy Mende, out of contract in 2025. He will be signed till 2027 and another important extension for Real Madrid is expected. The player has already signed the new deal."
5,4GuMWHaJh_g.json,2024/10/05,Antonio Rüdiger,Tony Rudiger is on the market and available as a free agent. Real Madrid has been considering him for a possible signing. He is currently on contract with Inter Milan.
6,4GuMWHaJh_g.json,2024/10/05,Mayonetta,"Real Madrid is considering Mayonetta for a possible signing, as the club is looking for players to fill the positions of Eric Erik ten Hag. The future of Mayonetta is currently uncertain and the player is waiting to see how his situation with Aston Villa unfolds."
7,4GuMWHaJh_g.json,2024/10/05,Gabriel,"Real Madrid has been considering Gabriel for a possible signing, as the club is looking for players to fill the positions of Eric Erik ten Hag. The future of Gabriel is currently uncertain and the player is waiting to see how his situation with Manchester United unfolds."
8,4GuMWHaJh_g.json,2024/10/05,Ben,"Ben is on contract with Juventus and has been mentioned in relation to the transfer market. However, it's not clear if a transfer is imminent for the player."
9,4hcYTUJivw8.json,2025/04/27,Dean Henderson,"Arsenal has been looking at the possibility of signing him on a long-term contract, but negotiations are still ongoing. The feeling is very good between Thomas and Arteta, who did very well this season especially in the UEFA Europa League."
10,4hcYTUJivw8.json,2025/04/27,Jorginho,"The idea with Flanengo pushing a lot for Jorginho, the idea is to negotiate a new deal with Thomas because the feeling is very good between Thomas and Arteta. He did very well this season especially in the UEFA Europa League."
11,4hcYTUJivw8.json,2025/04/27,Trent Alexander-Arnold,"Despite social media stuff and celebrations, Trent Alexander-Arnold is expected to join Real Madrid Madrid. The deal for Trent Alexander-Arnold to Real Madrid Madrid is at the final stages just waiting for the formal steps, just waiting to sign all the contracts, just waiting to complete all (topic: Arnold)"
12,4hcYTUJivw8.json,2025/04/27,Mikel Arteta,"Patti Thomas Patti is negotiating a new deal at Arsenal. There is a conversation ongoing now between the club, between the new director Andrea Berta, with Michel Arteta obviously approving everything and Thomas Patti over a potential contract extension. Jorginho is leaving the club so Jorginho will not be part of Arsenal's squad for the upcoming season."
13,4hcYTUJivw8.json,2025/04/27,Cugna,Schcugna is keen on joining the team. There is a great feeling as I told you on Mohamed Salahnday between May Manchester United and Cugna and so new round of talks coming soon to get this deal in the final stages to get this deal done and to come here with the here we go.
14,4hcYTUJivw8.json,2025/04/27,Kim,"Matteo Scugna, Trent Alexander-Arnold Alexander, Arnold, Kim Minj, Thomas Dean Dean Hendersonon, and much more are mentioned as being part of transfer discussions. The Korean defender Kim is considered a possible addition to the team, but there is a possibility for him to leave Bayer Leverkusenn in the summer transfer window if a good proposal comes to the table. Kim Min Jae has been linked with Saudi clubs and Real Madridly clubs Inter Milanested in Europe calling and asking about his situation."
15,4hcYTUJivw8.json,2025/04/27,Mohamed Salahnday,"Manchester United are looking to sign Matteo Schcugna as soon as possible, so there is no transfer news mentioned for Mohamed Salahnday."
16,4hcYTUJivw8.json,2025/04/27,Kim Min Jae,"The Korean defender Kim is something I want to add on defenders. There is a possibility for him to leave Bayer Leverkusenn in the summer transfer window if a good proposal comes to the table. Kim is also considered as one of the possible targets for Saudi clubs, and Inter Milanested in Europe calling and asking about his situation."
17,4hcYTUJivw8.json,2025/04/27,Dean Hendersonen,Every day you can find five different stories five different versions remember what I was telling you in January. The club is not involved in any transfer discussions involving Dean Dean Hendersonen as he has a release clause.
18,4hcYTUJivw8.json,2025/04/27,Real Madrid,"Real Madrid is considering signing a defender, with the possibility of Kim Min Jae from Bayer Leverkusen being one option. Talks are ongoing and could be set to a deal soon."
19,4hcYTUJivw8.json,2025/04/27,Thomas Partey,"Thomas Patti is negotiating a new deal at Arsenal, which may include an extension on his current contract."
20,4hcYTUJivw8.json,2025/04/27,Jamie Vardy,Jamie Vardy is considering a move from Leicester City to Manchester City after 13 years at the club. He is looking for something different and new challenges.
21,4hcYTUJivw8.json,2025/04/27,Thomas Müller,Thomas is also in talks with Arsenal for a potential contract extension.
22,4hcYTUJivw8.json,2025/04/27,Matteo Schcugna,"Matteo Schcugna is being considered by Manchester United, but further details have not been disclosed yet."
23,4KpoHDqijFA.json,2025/04/20,Carlo Ancelotti,Real Madrid's situation and future.
24,4KpoHDqijFA.json,2025/04/20,De Bruyne,transfer information not found.
25,4KpoHDqijFA.json,2025/04/20,Neymar,transfer information not found.
26,4KpoHDqijFA.json,2025/04/20,Kevin De Bruyne,transfer information not found.
27,4KpoHDqijFA.json,2025/04/20,Angriizman,transfer information not found.
28,4KpoHDqijFA.json,2025/04/20,Neymar Jr.,transfer information not found.
29,4KpoHDqijFA.json,2025/04/20,Arteta,"to discuss all the latest on the transfer market as always. Guys, many things to say. Carlo Carlo Ancelotti **Arteta**, Griezmann, van Virgil van Dijk, De Bruyne, Neymar, Jr. and much more. Let's jump into it together (topic: Bruyne)"
30,4KpoHDqijFA.json,2025/04/20,Griezmann,"about all the latest on the transfer market as always. Guys, many things to say. Carlo Carlo Ancelotti Arteta, **Griezmann**, van Virgil van Dijk, De Bruyne, Neymar, Jr. and much more. Let's jump into it together (topic: Bruyne)"
31,4KpoHDqijFA.json,2025/04/20,Martín Zubimendi,"Arteta will be backed on the market, Arteta will have a lot of power on the market, together with Andrea Bertha they will plan for the strategy, **Zubi Mendi** is at the top target, the new Strikers will arrive, Arsenal will do also more on the market, so Arsenal are working hard on **Zubi Mendi**, (topic: General)"
32,4KpoHDqijFA.json,2025/04/20,Xabi Alonso,Real Madrid's planning for the future and Alonso as a target.
33,4KpoHDqijFA.json,2025/04/20,Real Madrid,"Important to say that he said no to very big proposals also from Saudi. So Virgil van Virgil van Dijk was **Real Madridly** committed to Liverpool, **Real Madridly** wanted to do his best for Liverpool, stayed at the club, not taking a pay cut. So the salary (topic: Real)"
34,4KpoHDqijFA.json,2025/04/20,Jr.,"assessing all the projects, all the options, but Chicago Fire Fire already wanted Neymar **Jr**. some time ago, so Chicago Fire tried to sign Neymar, then he rejoined Santos."
35,4KpoHDqijFA.json,2025/04/20,Virgil van Dijk,Liverpool's transfer plans and possible departure.
36,4KpoHDqijFA.json,2025/04/20,Santos,Chicago Fire's interest in him and potential move.
37,4KpoHDqijFA.json,2025/04/20,Mikel Merino,Arsenal's Strikers situation and Merino's role.
38,4KpoHDqijFA.json,2025/04/20,Antoine Griezmann,Not mentioned in any transfer context.
39,4M_sDxUb8-c.json,2025/02/04,Milan,Signed a loan move for Joe Felix. No buy option close. Joe Felix will return to Chelsea at the end of the season.
40,4M_sDxUb8-c.json,2025/02/04,John Durant,Not mentioned any transfer news.
41,4M_sDxUb8-c.json,2025/02/04,Real Madrid,"Busy on AC Milan side, signed Mohamed Salahnza on a permanent transfer and is also looking for a new center back."
42,4M_sDxUb8-c.json,2025/02/04,Nico Gonzalez,"Sold to Manchester City, but the terms of the deal have not been disclosed. Guardiola has also joined the team."
43,4M_sDxUb8-c.json,2025/02/04,Guardiola,Not mentioned any transfer news.
44,4M_sDxUb8-c.json,2025/02/04,Mohamed Salahnza,Signed on a permanent transfer with Inter Milan.
45,4M_sDxUb8-c.json,2025/02/04,Aston Villa,No specific transfer information mentioned.
46,4M_sDxUb8-c.json,2025/02/04,Altimira,"+ Considered for a signing by Manchester City, but ultimately decided to sign Nico Gonzalez instead + Will be monitored for the future"
47,4M_sDxUb8-c.json,2025/02/04,Cesko,"+ Considered as a dream option by Arsenault, but unlikely to be signed in January + Staying at Betis for now, with no signing planned"
48,4M_sDxUb8-c.json,2025/02/04,Alejandro Garnaccio,+ Decided to keep at Manchester United + No news of any transfer plans
49,4M_sDxUb8-c.json,2025/02/04,Fabrizio Romano,+ Buy option close for Mattis Tell + Nico Gulsales signed by Manchester City instead
50,4M_sDxUb8-c.json,2025/02/04,Patrick Dorgue,"+ Signed by Aston Villa with salary covered and no buy option + Faced competition from Manchester United, but ultimately signed by Aston Villa."
51,4M_sDxUb8-c.json,2025/02/04,Joe Felix,"Loan move to Milan for 5 million pounds with no buy option, will return to Chelsea at the end of the season."
52,4M_sDxUb8-c.json,2025/02/04,Mattis Tell,"Permanent transfer to Tottenham for 60 million UEFA Cup, with a buy option close that has yet to be finalized."
53,4M_sDxUb8-c.json,2025/02/04,Inter Milan,No specific transfer information mentioned.
54,4M_sDxUb8-c.json,2025/02/04,Marco Silva,No specific transfer information mentioned.
55,4M_sDxUb8-c.json,2025/02/04,Arsenault,No specific transfer information mentioned.
56,4M_sDxUb8-c.json,2025/02/04,Garnaccio,Manchester United will keep him in summer 25 if there is a good opportunity. Chelsea considered him but decided to continue with the current squad.
57,4M_sDxUb8-c.json,2025/02/04,Axel DiSasi,"Tottenham agreed to loan him from Chelsea for a striped loan but at the end of the day Chelsea only wanted to give the player to Tottenham not to Aston Villa, despite DiSasi wanting to join Aston Villa."
58,4M_sDxUb8-c.json,2025/02/04,Oven,Nottingham Forest will have him on loan with an option to buy £4 million from Manchester City in summer.
59,4M_sDxUb8-c.json,2025/02/04,DiSasi,Chelsea only wanted to give the player to Tottenham not to Aston Villa. Felix is a done deal to have the green light on a buy option close for Mattis Tell.
60,4M_sDxUb8-c.json,2025/02/04,Felix,"Joe Felix to Milan is a done deal on a loan move, Milan will pay in excess of 5 million pounds for Joe Felix but there is no buy option close."
61,4M_sDxUb8-c.json,2025/02/04,Salah,"will have this player from the summer, many things happening, many things will happen, we know guys from now on we will start with the contracts, Salah, Tandaik, Real Madrid Madrid on 30, Alexander Arnold, many other things guys get ready because it's just the beginning of a new era but this (topic: General)"
62,4M_sDxUb8-c.json,2025/02/04,Kung,"will change many things, meanwhile Manchester Manchester United also decided to keep Alejandro Garnaccio and that's the news I think, the players staying at the club, Kung at Chelsea for example, he was an option for Bayer Leverkusenn at the beginning of the market, he was an idea for Manchester Manchester United but he never (topic: Manchester), leave on loan and now he's staying at Chelsea, Let's see how it goes in the second half of the season because I have a feeling that Kung could leave Chelsea next summer, so in summer 25 if there is a good opportunity and then also we staying at Manchester Manchester Manchester United Alejandro Garnaccio who had (topic: Manchester), it and then also important to say that Chelsea considered Garnaccio but then they decided to continue with the current squad, to Let Jo Felix go, to keep Kung at the club and to invest upfront in the summer, Arsenault did the same, probably the most asked question of the deadline day, what Arsenault are gon (topic: Manchester)"
63,4M_sDxUb8-c.json,2025/02/04,Leon Bailey,"for Manchester Manchester United the decision was different, Let's not sign any player on that line they were considering some opportunities, two days ago they called for Leon Bailey to Aston Villa but Aston Villa weren't able to sign Joe Felix and so nothing in terms of exit for Leon Bailey, Aston Villa signed Marco Marco Asensio (topic: General), , two days ago they called for Leon Bailey to Aston Villa but Aston Villa weren't able to sign Joe Felix and so nothing in terms of exit for Leon Bailey, Aston Villa signed Marco Marco Asensio and Aston Villa were very busy also with Axel DiSasi, another crazy story of this deadline day because Tottenham agreed with Chelsea (topic: General)"
64,4M_sDxUb8-c.json,2025/02/04,Fulham,"have the player anymore going to Nottingham Nottingham Forest on loan with an option to buy £4 million, also important to say that many movements took place around Fulham considering two questions and then they decided to go for William who returns to Premier League football on a free transfer as he returns from Olympia because to Premier League to work with Marco Silva at Fulham and then guys all the rest we know Ben Schilwell going to Crystal Palace and many other movements around Europe, Inter Milan signed Peta Sousic for the future from (topic: General)"
66,4q8c3WWxR5E.json,2025/05/07,Position,Fullback
67,4q8c3WWxR5E.json,2025/05/07,Current Team,Liverpool FC
68,4q8c3WWxR5E.json,2025/05/07,Contract Situation,Trent Alexander-Arnold's contract at Liverpool FC is expiring at the end of the season.
69,4q8c3WWxR5E.json,2025/05/07,Transfer Target,Real Madrid CF
70,4q8c3WWxR5E.json,2025/05/07,Salary Requirements,"The transfer fee for Trent Alexander-Arnold is expected to be around €50 million, but it is unclear if Real Madrid will offer this amount."
71,5ITcwf6uUn8.json,2025/01/16,Victor Osimhen,
72,5ITcwf6uUn8.json,2025/01/16,Transfer type,signing
73,5ITcwf6uUn8.json,2025/01/16,Value,9-10 million UEFA Cup European Championship
74,6kzk7hL1rJE.json,2025/04/11,David Fratesi,"David Frattesi is another Italian midfielder who plays for Napoli. He is also being considered for a transfer by Inter Milan, and there have been talks about his potential transfer to Juventusntus."
75,6kzk7hL1rJE.json,2025/04/11,Rasmus Højlund,"Rasmus Oylund, an attacker for Manchester United, is being considered for a transfer by Juventusntus. The club has expressed interest in signing him, and there have been initial contacts for illustrative purposes."
76,6kzk7hL1rJE.json,2025/04/11,McKenney,"The attacker, which could still be a priority for Napoli to strengthen the rose. So this is the situation of David David Fratesi we close our video with **McKenney** because **McKenney** is Inter Milanactive with Juventusntus for long-term contracts, but the parts are not yet arrived at the place, but there are still more details to be."
77,6kzk7hL1rJE.json,2025/04/11,Oylund,"On Davide David Fratesi in addition to the attacker, which could still be a priority for Napoli to strengthen the rose. So this is the situation of **David David Fratesi** we close our video with **Oylund** because there are some Inter Milanested teams and he is signing with the Manchester United 24 goals in 84 Premier games, but in fact the continuation of the performance and the protagonist that perhaps he was expecting, that perhaps the same Manchester United expected the player to take, but today it is as if the scintilla was not Real Madridly scared."
78,6kzk7hL1rJE.json,2025/04/11,Sandro Tonali,"Sandro Tonali is an Italian midfielder who plays for Newcastle United. There has been significant interest in his future transfers, with both Napoli and Juventusntus expressing interest. It is currently unclear what decision Newcastle will make about his future."
79,6kzk7hL1rJE.json,2025/04/11,Juventus,"It is an Italian national team that has two players, Sandro Sandro Tonali and Davide Frattesi, who are being considered for transfers. The club has also put Sandro Sandro Tonali at the top of its list of transfer targets. There is interest from other clubs in Italy, including Napoli, in Oylund's future."
80,6qDb6rkIsNs.json,2025/05/18,Jeremie FrimPong(correct spelling),"Important week for the transfer market, many things will happen and one of the first things that will happen in the upcoming days is the medical test of Jeremie FrimPong as new Liverpool player. He was stunned by a Liverpool player who had already informed about Liverpool decision to proceed. He has reported in the recent days five-year deal, so everything is done for Jeremy FrimPong to Liverpool. Now we enter into the formal steps. Tomorrow FrimPong will travel for medical test, contract signing, so everything will be completed in the next hours, authorized by Bayer Leverkusen-Leverkusen. One more addition for Liverpool, FrimPong and don't forget, according to my information, Liverpool also won't Left back. Liverpool remain in conversation for a potential signing."
81,6qDb6rkIsNs.json,2025/05/18,Martín Zubimendi(correct spelling),"They were prepared, for example, I'm talking about March 2024 to make an effort to pay the close for Martín Zubimendi. So he's always been a player wanted by Xabi Alonso Lonso. But what they can guarantee is that nothing is ongoing between Real Madrid Madrid, Real Madrid Real Real Sociedad the agents of Martín Zubimendi, because Martín Zubimendi will play for Arsenal this deal can't be hijacked from what I'm hearing. Everything is agreed, everything is okay. So it's just about the (topic: Real)."
82,6qDb6rkIsNs.json,2025/05/18,Joe Bellingham(correct spelling),"There is also Inter Milanested from Premier League. So it's true that some Premier League clubs seem cold to be informed on the conditions of potential deal for Joe Bellingham. But my information is that Borussia Dortmund are in love with Joe Bellingham, are giving eventually priority to Joe Bellingham over other potential targets. For example, Karnic Karny Chukwameka who is on loan at Borussia Dortmund from Chelsea, they would like to keep Karny Chukwameka but their priority step is going to try to sign Joe Bellingham. So this is what Borussia Dortmund will do in the next weeks. They will try to get in touch with Sanderland. They will try to get in (topic: Bellingham)."
83,6qDb6rkIsNs.json,2025/05/18,Ryan Cherokee(correct spelling),"There is a chance to see Real Madrid Madrid going for a midfielder, as mentioned. But my information is that that midfielder will not be Martín Zubimendi expected to be the first point of an important summer at Arsenal Today there was a message from the owners confirming they're willing to invest money to help reshape (topic: Martín)."
84,6qDb6rkIsNs.json,2025/05/18,Karny Chukwameka,Borussia Dortmund is considering keeping him but their priority is to sign Joe Bellingham.
85,6qDb6rkIsNs.json,2025/05/18,Xabi Alonso,"Real Madrid wants to sign a left back and is interested in Xabi Alonso Lonso, who was a target for them last year. They are also considering bringing in a new midfielder."
86,6qDb6rkIsNs.json,2025/05/18,Victor Osimhen,Liverpool is actively looking at him as a hot name for the summer transfer window. He will leave Sporting this summer for around 60-65 million UEFA Cup European Championship.
87,6qDb6rkIsNs.json,2025/05/18,Sanderland,Borussia Dortmund wants to try and get in touch with him for potential exit conditions.
88,6qDb6rkIsNs.json,2025/05/18,Giocares,"Liverpool is interested in him, but he will leave Sporting this summer for around 60-65 million UEFA Cup European Championship package."
89,6qDb6rkIsNs.json,2025/05/18,Jeremy Jeremie FrimPong,He has reported for a medical test as a new Liverpool player after signing a five-year deal with the club.
90,6vrnHITNYpk.json,2024/08/11,Manuel Ugarte,"Manchester United is interested in signing Ugarte from Paris Saint-Germain. The top target for the team is Ugarte, but they are waiting to see what happens with Paris and Germany before making a move. United has considered alternative options such as Sander Berge and Victor Osimhen."
91,6vrnHITNYpk.json,2024/08/11,Raffaella Pimenta,Manchester United has agreed to sign Pimenta from Fiorentina on a five-year deal plus an option for another season. The transfer is expected to be completed soon.
92,6vrnHITNYpk.json,2024/08/11,Malacia,"Manchester United is considering signing Malacia as a Left Back option. The team has also been linked with Real Madrid, but Malacia may prefer to stay at Ajax."
93,6vrnHITNYpk.json,2024/08/11,Lucaku,Chelsea and Napoli are currently in talks over Lucaku's transfer from Chelsea to Napoli. The deal is expected to be completed soon.
94,6vrnHITNYpk.json,2024/08/11,Matthijs de Ligt,"Manchester United is reportedly close to signing De Ligt on a five-year deal plus an option for another season. The player has been linked with both Real Madrid and Barcelona, but United is currently leading the race for his signature."
95,6vrnHITNYpk.json,2024/08/11,Osimhen,datro for fauna is another player who could leave chelsea on a permanent transfer or loan with obligation so chelsea will be busy with the outcoins many questions on victor Osimhen guys i can guarantee to you that nothing is changing today yesterday tomorrow so this weekend will be quiet for the victor Osimhen story but the plan remains to live (topic: Victor)
96,6vrnHITNYpk.json,2024/08/11,Jonathan Tau,plus five in add-ons this is the double deal between Manchester Manchester United and Bayer Leverkusenn with Bayer Leverkusenn now expected to sign one more centre-back Jonathan Tau is waiting for them his agent Pinizzahavi is still working on the deal for Jonathan Tau to go to Bayer Leverkusenn so Let's wait for the developments for Jonathan Tau to Bayer Leverkusenn but he's expected to be the new centre-back for (topic: Bayer)
97,6vrnHITNYpk.json,2024/08/11,Bradford,million pounds also Fabio Carvalho leaves Liverpool while they are still working to convince Martin Zubimendi to join the club waiting for his final decision and Fabio Carvalho goes to Bradford for 20 million pounds plus 7.5 in a don'ts and 17.5 percentage of future sale so a sell-on close into the deal with Bradford for Fabio Carvalho movements (topic: General)
98,6vrnHITNYpk.json,2024/08/11,Noussair Mazraoui,Manchester United are going to attack the market may Manchester United want to sign at least three more could be four and now we have the two players they wanted **Noussair Mazraoui** and the Ligt two Manchester Manchester United is here we go because it's deal the deal is done with Bayer Leverkusenn and we have to mention that Manchester Manchester (topic: Manchester)
99,6vrnHITNYpk.json,2024/08/11,Jadon Sancho,the timing was absolutely important Let me tell you guys something more than Manchester Manchester United will now focus on the midfielder Let's wait to see what happens with **Jadon Jadon Sancho** **Jadon Jadon Sancho** is one of the cases of this market but in terms of new midfielder Manchester Manchester United remain busy may Manchester United spoke to the agents of (topic: Jadon)
100,6vrnHITNYpk.json,2024/08/11,Nusair Noussair Mazraoui,he's expected to more of the medical test for one missac right after Manchester Manchester United will be ready for the travel the medical of Matías De Ligt and **Nusair Noussair Mazraoui** both players will sign a five-year deal at Manchester Manchester United 2029 plus option for further season this is the agreement an agreement that the agent of the (topic: Manchester)
101,6vrnHITNYpk.json,2024/08/11,Broja,Expected to leave Chelsea and dreaming of a move to Real Madrid.
102,6vrnHITNYpk.json,2024/08/11,Fabio Carvalho,Leaves Liverpool for Bradford City.
103,6vrnHITNYpk.json,2024/08/11,Matías De Ligt,Set to sign for Manchester United.
104,6vrnHITNYpk.json,2024/08/11,Romelu Lukaku,"Waiting to complete his move to Napoli, Italy."
105,6vrnHITNYpk.json,2024/08/11,Alexander Isak,"Aaron Wan-Bissaka to West Ham is a confirmed story that we told you here several times. It's a crucial one because he had one year left on his contract and other possibilities, such as staying at Manchester United or moving to Inter Milan in a potential move next summer on a free transfer not in a swap deal. He has decided to accept West Ham for a five-year contract. The value of the deal is 15 million pounds."
106,7beeiCQxcXg.json,2025/01/23,Pedri,"Araujo signs tomorrow, new contract until 2031. The next ones will be Gerard Martín, Gavi and then in the next months, La Milla Manne."
107,7beeiCQxcXg.json,2025/01/23,Kyle Walker,Man City captain is leaving Manchester City to join a similar agreement done at Italy.
108,7beeiCQxcXg.json,2025/01/23,Milan,Milano Santos signing a loan deal with a buy option around 5 million UEFA Cup European Championship with Milan.
109,7beeiCQxcXg.json,2025/01/23,Rashford,"Barcelona are in negotiations for Marcos Rashford, but they need space on the financial point of view."
110,7beeiCQxcXg.json,2025/01/23,Adeyemi,"Borussia Dortmund is in contact with Napoli for Karim Adeyemi, but it is unclear what will happen next."
111,7beeiCQxcXg.json,2025/01/23,Marcos Rashford,"Barcelona is considering signing Marcos Rashford, but it depends on his desire to go to Spain and the financial aspect of the deal."
