,filename,date,player,rumors
519,GHDMkAoQUOM.json,2024/09/24,Enzo Maresca,The Argentine midfielder has been rumored to be a target for Tottenham Hotspur. The deal is said to be worth around £8 million.
520,GHDMkAoQUOM.json,2024/09/24,Anthony Marzial,The French midfielder has been linked with a move from Monaco to Napoli. The deal is said to be worth around €15 million.
522,grxr0-SMBns.json,2024/07/15,André Onana,linked with a move to Everton
523,grxr0-SMBns.json,2024/07/15,Raphaël Varane,rumored to be considering a transfer to Manchester United
524,grxr0-SMBns.json,2024/07/15,Nico Williams,interested in signing for Ajax
525,grxr0-SMBns.json,2024/07/15,Matais De Ligt,set to join Barcelona from Ajax
526,grxr0-SMBns.json,2024/07/15,Willyan Capemba,reportedly being considered by AC Milan.
527,grxr0-SMBns.json,2024/07/15,Mohamed Salahussa Dembélé,Sold to Paris Saint-Mohamed Salahussa Dembélé for a reported £138 million transfer fee.
528,grxr0-SMBns.json,2024/07/15,Julian,"Linked with a possible move to Aston Villa, but no official transfer news has been announced yet."
529,grxr0-SMBns.json,2024/07/15,Aston Villa,Rumored to be interested in signing Julian on a permanent basis.
530,grxr0-SMBns.json,2024/07/15,Paris Saint-Mohamed Salahussa Dembélé,Selling Mohamed Salahussa Dembélé for a reported £138 million transfer fee.
531,hIuJySt7zAI.json,2025/05/01,Jowicz,"Milan, Nuno Tavares"
532,hIuJySt7zAI.json,2025/05/01,Milan,"Jowicz, Fabrizio Romano"
533,hIuJySt7zAI.json,2025/05/01,Nuno Tavares,Juventusntus
534,hIuJySt7zAI.json,2025/05/01,Fabrizio Romano,"Milan, Luka Jowicz"
535,hIuJySt7zAI.json,2025/05/01,Luca Jowicz,Milan
536,HUBnW1GvN5c.json,2025/03/13,Virgil van Dijk,"Arrival, signing, close to, departure, set to, expected to, likely to, potential, possible, reported, alleged, suggested, claimed."
537,HUBnW1GvN5c.json,2025/03/13,William Saliba,"There are rumors that Arsenal is interested in signing him from Chelsea. Arteta has reportedly met with Saliba's representatives to discuss a possible transfer. However, no official bid has been made yet and the deal is not set to be completed anytime soon."
538,HUBnW1GvN5c.json,2025/03/13,Trent Alexander-Arnold,"Arteta is reportedly considering signing him on a permanent basis. Inter Milan have also expressed interest in the young fullback. Oven has also been linked to a move for Alexander-Arnold, but there is no concrete news about it yet."
539,HUBnW1GvN5c.json,2025/03/13,Inter Milan,"They are reportedly close to signing a new center forward, but there is no news about the identity of the player yet."
540,HUBnW1GvN5c.json,2025/03/13,Mikel Arteta,"There have been reports that he wants to sign Trent Alexander-Arnold from Liverpool on a permanent basis, but there is no concrete news about the deal yet. He has also been linked to a move for William Saliba from Chelsea."
541,hUDjFskQ44M.json,2024/09/30,Antoine Griezmann,"Griezmann is reportedly being pursued by Real Madrid, with the club expressing interest in signing him. He has also been linked to Barcelona and Manchester United."
542,hUDjFskQ44M.json,2024/09/30,ArrizaBalaga,"Arrival, departure, target, linked, enquiry, pursuit, speculation, considering, exploring, tracking, scouting, wants, desires, keen, eyeing, planning, preparing, close to, verge of, set to, expected to, likely to, potential, possible, reported, alleged, suggested, claimed"
543,Hwem_sxXZ7U.json,2025/01/16,Trevoh Chalobah,Trevo Schalobar's transfer to Real Madridly has been claimed by some sources.
544,Hwem_sxXZ7U.json,2025/01/16,Real Madrid,Real Madridly is set to sign a player from Inter Milan.
545,Hwem_sxXZ7U.json,2025/01/16,Martin Subimendi,Juventusntus are rumored to be interested in signing him.
546,Hwem_sxXZ7U.json,2025/01/16,Cristofran Cuncu,+ Allegedly linked with a move to Juventus. + Claimed interest from Chelsea. + Reported interest from Liverpool. + Considering a potential move to Barcelona. + Tracking progress at Juventus.
547,Hwem_sxXZ7U.json,2025/01/16,Iñigo Martínez,+ Linked with interest from Juventus. + Rumored to be considering a move abroad. + Exploring options for a possible transfer. + Allegedly being tracked by Real Madrid.
548,HYiSejOYDNs.json,2024/07/31,Manuel Ugarte,"Real Madridly, reported, linked, enquired, approached, monitored, eyeing, planning, preparing, close to, set to."
549,HYiSejOYDNs.json,2024/07/31,Gabriel Mack,"Milan, rumored, considering, exploring, tracking, scouting, wanted, desired."
550,HYiSejOYDNs.json,2024/07/31,Anthony Gordon,"Real Madridly, reported, linked, enquired, approached, monitored, eyeing, planning, preparing, close to, set to."
551,HYiSejOYDNs.json,2024/07/31,Marco Silva,Selling to Fulham. No specific transfer details mentioned.
552,HYiSejOYDNs.json,2024/07/31,Fulham,Buying from VillarReal. No specific transfer details mentioned.
553,HYiSejOYDNs.json,2024/07/31,Emile Smith Rowe,"* Interested in a potential loan move to Fulham, but West Ham are reluctant to let him go. (January 2023) * Linked with a possible move to Arsenal as they look to strengthen their midfield options. (December 2022) * A £15m bid from Crystal Palace has been rejected by West Ham for Smith Rowe. (November 2022) * Sought clarification on his future with West Ham after being left out of their squad for the North London derby. (October 2022) * Rejected a £15m bid from Crystal Palace for Smith Rowe. (September 2022)"
554,i5cZnhNrzIM.json,2024/08/29,Ben Chilwell,Arsenal are reportedly interested in signing Ben Chilwell from Leicester City for £50m.
555,i5cZnhNrzIM.json,2024/08/29,Onyeka Osimhen,"Espanyol are reportedly interested in signing the Nigerian striker, with negotiations ongoing."
556,i5cZnhNrzIM.json,2024/08/29,Mohamed Salahnday,There have been no recent reports of a transfer for this player.
557,i5cZnhNrzIM.json,2024/08/29,Darwin Núñez,"Darwin Núñez is linked to Liverpool and is reportedly considering a move to the Premier League. He has been tracked by several clubs and is being monitored closely. There have been rumors of interest from Barcelona and Manchester United, but it's unclear if any formal offers have been made."
558,i5cZnhNrzIM.json,2024/08/29,Dani Carvajal Ceballos,The player is being monitored by Real Madrid.
559,i5cZnhNrzIM.json,2024/08/29,Real Madrid,There is no transfer news mentioned about the team.
560,i5cZnhNrzIM.json,2024/08/29,Betis,Raoucho is being linked to a move away from the club.
561,i5cZnhNrzIM.json,2024/08/29,Rauch,The player is reportedly being pursued by a number of clubs.
562,i5cZnhNrzIM.json,2024/08/29,Jadon Sancho,Inter Milanested in Jadon Sancho.
563,i5cZnhNrzIM.json,2024/08/29,Thiago Alcântara,"Thiago Mohamed Salahtta has been linked to Tottenham Hotspur and is reportedly considering a move to the Premier League. There have been discussions and negotiations around a possible transfer, but nothing concrete has been agreed upon yet."
564,i5cZnhNrzIM.json,2024/08/29,Darwin,"Darwin is rumored to be considering a move away from Liverpool, but there have been no specific reports of interest from any clubs."
565,i5cZnhNrzIM.json,2024/08/29,Raheem Sterling,Juventus are reportedly interested in signing the Manchester City winger.
566,i5cZnhNrzIM.json,2024/08/29,Ray Snelson,The Scottish midfielder is considering a move to Celtic.
567,i5cZnhNrzIM.json,2024/08/29,Benfica,They are linked with a bid for the Barcelona defender Sergi Roberto.
568,i5cZnhNrzIM.json,2024/08/29,Jonathan David,The Ajax striker is reportedly being pursued by Tottenham Hotspur.
569,ig_knCy8F_Y.json,2024/11/10,Andriy Lunin,Andriy Lunin is reportedly interested in signing a new contract with Real Madrid. There have been no reports of any other transfers involving him at this time.
570,ig_knCy8F_Y.json,2024/11/10,Mady Camara,"Wesley Mady Camara has been linked to a potential transfer to Tottenham Hotspur, but there have been no confirmed negotiations or deals."
571,ig_knCy8F_Y.json,2024/11/10,Maurizio Pochettino,There have been no reports of any transfers involving Maurizio Pochettino at this time. He is currently the manager of Paris Saint-Germain.
572,ig_knCy8F_Y.json,2024/11/10,Courtois,There have been no reports of any transfers involving Courtois at this time. He is currently the goalkeeper for Real Madrid.
573,ig_knCy8F_Y.json,2024/11/10,Jamal Musiala,"Jamal Musialla has been linked to a potential transfer to Chelsea, but there have been no confirmed negotiations or deals."
574,ig_knCy8F_Y.json,2024/11/10,Thibaut Courtois,reportedly set to leave Chelsea for Atletico Madrid.
575,ig_knCy8F_Y.json,2024/11/10,Gjokores(Gjoko),"no specific transfer information mentioned, but linked with Roma."
576,IiC8CPmKzqs.json,2025/05/12,Dean Hendersonen,There are no reports of any transfer interest in Dean Hendersonen at this time.
577,IiC8CPmKzqs.json,2025/05/12,Kevin De Bruyne,Renewed contract with Manchester City. No transfer news mentioned.
578,IiC8CPmKzqs.json,2025/05/12,Al-Hilal,Selling to Valencia for €13 million.
579,IiC8CPmKzqs.json,2025/05/12,Ruben Amorim,Ruben Amorim is being monitored by Manchester United. The club has scouts watching him closely and there have been talks about a potential bid for the defender.
580,ijM3iCSlH_M.json,2024/12/12,Rashford,reportedly linked with a move to Chelsea
581,ijM3iCSlH_M.json,2024/12/12,Enzo Mariesca,enquired about signing with Juventus
582,ijM3iCSlH_M.json,2024/12/12,Arda Güler,rumored to be considering a move to Germany
584,J1T7rXodQcc.json,2024/08/17,Conor Gallagher(correctly),"no news about the player's transfer, but there have been rumors of interest from Arsenal and Liverpool."
585,J1T7rXodQcc.json,2024/08/17,Eberheciez,"no news about a transfer, but there have been talks about his future with Atletico Madrid."
586,J1T7rXodQcc.json,2024/08/17,Jofelic,"reportedly interested in a move to Barcelona, but no agreement has been reached yet."
587,J1T7rXodQcc.json,2024/08/17,Manuel Ugarte,"no news about a transfer, but Real Madrid is reportedly looking at him as a potential replacement for Modric."
588,J1T7rXodQcc.json,2024/08/17,Victor Osimhen,"ROsimhen has been linked with a move to Tottenham Hotspur, according to reports. Tottenham are reportedly interested in signing the Senegal international for around £60m."
589,J1T7rXodQcc.json,2024/08/17,Romelu Lukaku,"Romelu Lukaku is a target for Inter Milan, with reports suggesting that the club is preparing to make an offer for the Belgian striker. There have been ongoing discussions between Inter and Lukaku's agents, with sources claiming that a deal could be close. However, Lukaku has yet to sign a new contract with Manchester United, who he currently plays for."
590,J1T7rXodQcc.json,2024/08/17,Jadon Sancho,"Jadall Jadon Sancho is expected to leave Manchester City when his contract expires at the end of the season. The winger has been heavily linked with a move to Bayern Munich, but there have been no official confirmations yet."
591,J1T7rXodQcc.json,2024/08/17,Conor Gallagher,Conor Gallagher is reportedly being tracked by Liverpool and Chelsea ahead of the upcoming transfer window. The midfielder has been in excellent form for Crystal Palace this season and could attract interest from several top clubs.
592,J1T7rXodQcc.json,2024/08/17,Aston Villa,Aston Villa are reportedly interested in signing Leicester City defender Wesley Fofana for around £80m. The 21-year-old has been in impressive form for the Foxes this season and could be a target for the Midlands giants.
593,J1T7rXodQcc.json,2024/08/17,Ozymen,
594,JNNxpoejkmQ.json,2024/07/23,Miquel Merino,"reportedly linked to a move to Real Madrid, with talks ongoing"
595,JNNxpoejkmQ.json,2024/07/23,Nico williams,"rumored to be a target for Barcelona, with negotiations set to begin"
596,JUZVtko4j9M.json,2025/02/02,Marco Asensio,Transfer rumors mentioned.
597,JUZVtko4j9M.json,2025/02/02,Joe Felix,"Transfer negotiations are ongoing. Benfica has been reportedly keen on signing the young American midfielder, with a bid of around €50 million being touted. The player has also been linked to several other clubs, including Juventus and Chelsea, but it remains unclear where his future lies at this time."
598,jwrmm9jkaTg.json,2025/04/02,Harry Kane,"transfer rumors, interest, talks, negotiations, approach, enquiry, pursuit, speculation, considering, exploring, monitoring, tracking, scouting, wants, desires, keen, eyeing, planning, preparing, close to, verge of, set to, expected to, likely to, potential, possible"
599,jxhduO7uZ50.json,2024/12/03,Fabrizio Romano AS,"+ The journalist has been reporting on the transfer rumors surrounding Diallo and other players. + He has claimed that Liverpool is interested in signing Diallo, but that the deal may not be possible due to financial constraints. + Romano has also reported that United is looking at a potential transfer for Diallo."
600,jxhduO7uZ50.json,2024/12/03,Reece James,"+ There have been rumors of interest from Manchester City and Chelsea, with talks reportedly taking place over a possible move. + The defender is said to be keen on the move and wants to leave Leicester this summer. + A deal has not yet been reached, but negotiations are ongoing."
601,jxhduO7uZ50.json,2024/12/03,Raul Marco Asensio,"+ The Real Madrid midfielder has been linked with a move to Chelsea, with talks reportedly taking place over a possible transfer. + The deal is said to be close to completion, with a bid believed to have been agreed upon. + Romano has claimed that Chelsea is interested in signing Asensio and that the player wants to leave Real Madrid this summer."
602,jxhduO7uZ50.json,2024/12/03,Salah,"+ There have been rumors of interest from various clubs, including Liverpool and Manchester City, but no concrete information about a transfer has been reported yet. + The player's contract with Liverpool is set to expire in 2023 and there have been discussions about extending it. + Salah has expressed his desire to remain at Liverpool, but a deal may not be possible due to financial constraints."
603,jxhduO7uZ50.json,2024/12/03,Mohamed Salah,"Selling to Barcelona for €120 million, signing a five-year contract."
604,jxhduO7uZ50.json,2024/12/03,Enzo Mariscal,"Buying from Atlético Madrid for €50 million, signing a four-year contract."
606,KeqkhdiB7B4.json,2024/08/27,Jadon Sancho,"Arrival, signing, move, switch, target, linked, approach, enquiry, pursuit, speculation, considering, exploring, monitoring, tracking, scouting, wants, desires, keen, eyeing, planning, preparing, close to, verge of, set to, expected to, likely to, potential, possible, reported, alleged, suggested, claimed."
607,KeqkhdiB7B4.json,2024/08/27,Coman,Linked with interest from Barcelona and Liverpool. Reportedly close to a deal with Atletico Madrid.
608,KeqkhdiB7B4.json,2024/08/27,Santiago Jimenez,Rumored to be a target of Tottenham Hotspur. Said to be open to a move away from Atletico Madrid.
609,KeqkhdiB7B4.json,2024/08/27,Rafael Leão,"Arrival, signing, move, switch, target, linked, approach, enquiry, pursuit, speculation, considering, exploring, monitoring, tracking, scouting, wants, desires, keen, eyeing, planning, preparing, close to, verge of, set to, expected to, likely to, potential, possible, reported, alleged, suggested, claimed."
611,kIvyL5hV974.json,2024/07/16,Pierre-Emerick Aubameyang,"Lukaku wants to leave Inter Milan and Arsenal is interested in signing him, according to reports."
612,kIvyL5hV974.json,2024/07/16,Lukaku,"Arsenal is interested in signing the Belgian striker, but Inter Milan is reportedly trying to keep him."
613,kIvyL5hV974.json,2024/07/16,Matíasse Tell,"There have been rumors of a potential move for the Senegalese midfielder, but nothing has been confirmed yet."
614,kIvyL5hV974.json,2024/07/16,OSM,There have been no transfer news mentioned for this player.
615,kIvyL5hV974.json,2024/07/16,Al-Khatib,There have been no transfer news mentioned for this player.
616,kIvyL5hV974.json,2024/07/16,Conte,There have been no transfer news mentioned for this player.
617,kIvyL5hV974.json,2024/07/16,Victor Osimhen,
618,kIvyL5hV974.json,2024/07/16,Transfer information,"rumored interest, speculation"
619,kIvyL5hV974.json,2024/07/16,Fabriz Fermanoguire,
620,kIvyL5hV974.json,2024/07/16,Mohamed Salahnaco,
621,kIvyL5hV974.json,2024/07/16,Antonio Conte,
623,KWE1y49iFjQ.json,2025/05/01,Max Massimiliano Allegri,no information available.
624,KWE1y49iFjQ.json,2025/05/01,Max,no information available.
625,KWE1y49iFjQ.json,2025/05/01,Ferguson,"Selling, target, linked, approached, negotiating, considering, exploring, monitoring, scouting, wanted, desired, keen, eyeing, planning, preparing, close to, verge of, set to, expected to, likely to, potential, possible, reported, alleged, suggested, claimed."
626,KYpPPIlgdtg.json,2024/11/10,Trent Alexander-Arnold,"Arsenal have reportedly agreed a deal with the defender, who will join the club on a free transfer in July."
627,KYpPPIlgdtg.json,2024/11/10,Amad Diallo,Alphonso Davies  No transfer news mentioned
628,KYpPPIlgdtg.json,2024/11/10,Eder Militao,Real Madridly  No transfer news mentioned
629,KYpPPIlgdtg.json,2024/11/10,Alphonso Davies,Palmeiras  No transfer news mentioned
630,L1CWNRnCZcw.json,2024/08/26,Federico Chiesa,"Federico Chiesa is a target for Juventus, as they look to strengthen their attacking options. Talks are ongoing between Juventus and his current club Fiorentina about a potential transfer."
631,L1CWNRnCZcw.json,2024/08/26,Jadon Sancho,"Sancho is reportedly being pursued by a number of top clubs, including Manchester United and Liverpool, with a potential deal worth £100m being speculated upon. He has also been linked to Chelsea and Paris Saint-Germain in the past."
632,L1CWNRnCZcw.json,2024/08/26,João Cancelo,"João Cancelo has been linked with a move away from Benfica. There have been rumors of interest from several top European clubs, including Manchester City and Liverpool."
633,L1CWNRnCZcw.json,2024/08/26,Al-Hilal,"Alilal is reportedly considering a switch to Juventusntus. Talks are ongoing about the deal, with a bid rumored to be set for the signing of Alilal by Juventusntus. The move could be finalized in the coming days, with Alilal set to depart from his current team."
634,L1CWNRnCZcw.json,2024/08/26,Juventus,"Juventusntus is reportedly interested in signing Alilal, with talks ongoing about a potential deal. The move is seen as a promising one for both parties and could bring significant benefits to their footballing operations."
635,L1CWNRnCZcw.json,2024/08/26,Alex Valle,"There are reports that Alex Valle is considering a move away from his current team. Some sources suggest that he is being courted by Merino, with negotiations ongoing about a potential deal. It is unclear whether a transfer will happen, but there is definitely interest in Alex Valle's services."
636,L1CWNRnCZcw.json,2024/08/26,Mikel Merino,"Merino is reportedly interested in signing Alex Valle, with negotiations ongoing about a potential deal. Some sources suggest that talks are close to being finalized, with a bid rumored to be set for the signing of Alex Valle by Merino. The move could bring significant benefits to both parties and is seen as a promising one for their footballing operations."
637,LiDaBPCGx7s.json,2024/12/06,Trent Alexander-Arnold,Linked with Real Madridly. Rumors of interest and talks about a possible transfer.
638,LiDaBPCGx7s.json,2024/12/06,Real Madrid,"Canonil, Colomoni, Trent Alexander-Arnold, Alfonso linked to the club as potential signings in various positions (backline, defense, midfield). The club has reportedly been monitoring their progress and considering making a move."
639,LiDaBPCGx7s.json,2024/12/06,Robert Lewandowski,reported interest in signing with Barcelona.
640,LiDaBPCGx7s.json,2024/12/06,Virgil van Dijk,reportedly linked to Chelsea.
641,LJeYtQPHhM4.json,2025/04/26,Carlo Ancelotti,reportedly wants to sign a new midfielder and is exploring the possibility of bringing in Real Madrid star Luka Modric. He is also considering a move for Manchester United's Bruno Fernandes.
642,LJeYtQPHhM4.json,2025/04/26,Cristiano Ronaldo Araujo,has been linked with a move to Juventus and is reportedly close to signing a contract with the Italian giants.
643,LJeYtQPHhM4.json,2025/04/26,Gibbs White,"has attracted interest from several clubs, including Tottenham Hotspur and Chelsea, who are both rumored to be considering making an offer for him."
644,LJeYtQPHhM4.json,2025/04/26,Mohamed Salahrgan Gibbs White,is not currently being linked with any transfer news.
645,LPU5sUlLbAQ.json,2025/01/20,Trent Alexander-Arnold,"linked to Liverpool, enquired by Arsenal, approach from Barcelona and Real Madrid, considering a move to Chelsea, planning a move to Manchester United, close to signing with Bayern Munich, set to sign for Inter Milan, reportedly interested in joining Manchester City."
646,LPU5sUlLbAQ.json,2025/01/20,Ansu Fati,"linked to Barcelona, interest from Real Madrid and Manchester United, talks with Chelsea, considering a move to Liverpool, speculated to be leaving Barça."
647,LPU5sUlLbAQ.json,2025/01/20,Fabrizio Romano,transfer information
648,LPU5sUlLbAQ.json,2025/01/20,Erling Haaland,Erling Haaland is being heavily linked with a move to Manchester United from Borussia Dortmund. The club has been in talks with the player's agent and is reportedly close to making an offer for the striker.
649,LPU5sUlLbAQ.json,2025/01/20,Joe Felix,"Juventus are reportedly interested in signing Joe Felix from Atletico Madrid, but no official bid has been made yet."
650,LPU5sUlLbAQ.json,2025/01/20,Antonio Conte,"Antonio Conte is being linked with a move to Tottenham Hotspur as their new manager. However, the club has yet to confirm any interest in the Italian coach."
651,lTK6JTu8364.json,2024/11/04,Nico William,Nico Williams is a target for Tottenham Hotspur. The club has been monitoring the player and are keen on signing him in the next transfer window. (source: BBC)
652,lTK6JTu8364.json,2024/11/04,Joshua Zierze,Joshua Zierze is a transfer target for Real Madrid. The club has been exploring options to strengthen their midfield and the player is considered a potential solution. (source: Marca)
653,lTK6JTu8364.json,2024/11/04,Mason Greenwood,Manchester United are reportedly considering selling Mason Greenwood in the next transfer window to raise funds for new signings. The club is currently facing financial difficulties and is looking to sell several players. (source: Daily Mail)
654,lTK6JTu8364.json,2024/11/04,Casemiro,Casemiro is a transfer target for Real Madrid. The club has been actively seeking to strengthen their defense and the player is seen as a potential solution. (source: Sky Sports)
655,lTK6JTu8364.json,2024/11/04,Matías De Ligt,Benfica has expressed interest in the 19-year-old center back.
656,LVjHxq_xqv4.json,2025/01/30,Rashford,"Marcos Rashford is reportedly a target for Manchester United to sign as a replacement for Cristiano Ronaldo. The club has made an offer of £100 million to bring the player back from Juventus, where he is currently on loan. It is understood that there are still negotiations ongoing between the two clubs and a deal could be close."
657,LVjHxq_xqv4.json,2025/01/30,Benjaminsche Schesco,"Benzema has been heavily linked with a move away from Real Madrid, with many clubs expressing interest in signing him. One of those clubs, Barcelona, have been reported to be closing in on a deal for the player, who is said to be keen on a return to Catalonia."
658,LVjHxq_xqv4.json,2025/01/30,Mattie Stell,"Mattie Stell is being monitored by several Premier League clubs as they look to add depth to their attacking options. Crystal Palace are understood to have made an enquiry about the player's availability, but there has been no formal offer made yet."
659,LVjHxq_xqv4.json,2025/01/30,Victor Boniface,"Victor Boniface is being tracked by several top European clubs, including Manchester United and Liverpool. The Scottish striker has been in excellent form for Rangers this season and his impressive performances have caught the attention of scouts across Europe."
660,LVjHxq_xqv4.json,2025/01/30,Real Madridly (correct spelling,Real Madrid): No transfer news mentioned.
661,LVjHxq_xqv4.json,2025/01/30,Ferguson (correct spelling,Ferguson): No transfer news mentioned.
662,LVjHxq_xqv4.json,2025/01/30,Ollie Watkins,Watkins): No transfer news mentioned.
663,LVjHxq_xqv4.json,2025/01/30,Al Naser (correct spelling,Al Nasser): No transfer news mentioned.
664,LVjHxq_xqv4.json,2025/01/30,Schesco (correct spelling,Schezzo): No transfer news mentioned.
665,LVjHxq_xqv4.json,2025/01/30,Oli Watkins (correct spelling,Ollie Watkins): No transfer news mentioned.
666,L_ENA78h-uA.json,2025/03/25,Fabrizio Romano,Inter Milan are reportedly exploring the possibility of signing him.
667,L_ENA78h-uA.json,2025/03/25,Zed,"Zed is a target for Liverpool, according to rumors. Liverpool are reportedly interested in signing the Dutch midfielder from Aston Villa. There have been talks between Liverpool and Aston Villa regarding a possible deal for Zed."
670,MBTciBUnPvI.json,2025/03/14,Bruno Fernandes,"Bruno Fernandes Fernandez is a target for Arsenal, according to reports in England. The English club are reportedly willing to pay up to £50m for the Portuguese midfielder and have already made an offer of around £40m. However, the player's current club, Benfica, are unlikely to accept the bid. The transfer is not set in stone and negotiations are ongoing."
671,MBTciBUnPvI.json,2025/03/14,Enzo Maresca,"Enzo Maresca is a target for Celtic, according to reports in Scotland. The Scottish champions have been linked with a move for the Argentine midfielder and are reportedly willing to pay up to £4m for his services. A bid has not yet been made for the player but talks are ongoing."
674,N5SYpcWAoQk.json,2024/08/31,Onyeka Osimhen,Onyeka Osimhen is set to move from Lille to Napoli. The transfer fee is reportedly €40 million.
